,Title,Journal,Abstract
44,Speeding in highway work zone: An Evaluation of methods of speed control,Accident; analysis and prevention,"Highway workers frequently work in close proximity of live traffic in highway work zones, traffic accidents therefore have devastating effects on worker safety. In order to reduce the potential for such accidents, methods involving use of advisory signs and police presence have been used to mitigate accident risks and improve safety for highway workers. This research evaluates the magnitude of the speeding problem in highway work zones and the effects of four levels of police presence on improving work zone safety. Speed data were collected in six different work zone locations in northern and southern California and used to determine the magnitude and nature of speeding problem in highway work zones. In addition data were collected over 11 test-days in four work zones with four levels of police presence: radar speed display with police decal and lighting, passive use of a police vehicle with radar speed display, passive use of a police vehicle without radar speed display, and active police speed enforcement near work zones. This paper analyzes this data using statistical methods to evaluate the effectiveness of these different methods of speed control on the safety of the work zone. Four Measures of Effectiveness (MOE) were used in this evaluation consisting of average speed reduction, speed variance, 85th percentile speed, and proportion of high speed vehicles. The results indicate that all levels of police presence provided statistically significant improvements in one or more of the MOEs."
45,Leadership skills for strengthening jobsite safety climate,Journal of safety research,"Introduction:                       Construction foremen may lack the leadership skills needed to create a strong jobsite safety climate. Many construction companies address this by sending their lead workers to the OSHA 30-h course; however the course does not include a leadership training module. This article describes the development and pilot testing of such a module and evaluation surveys designed to address this training gap.                  Methods:                       A 17-member curriculum development team, numerous subject matter experts, and an instructional design company helped us develop a comprehensive set of teaching resources and a set of survey instruments for evaluating the materials' effectiveness on improving safety leadership and safety climate. All materials and surveys were pilot tested with representative members of the target population.                  Results:                       Pilot surveys showed high reliability and data collected on the resulting Foundations for Safety Leadership (FSL) module indicated that the majority of foremen thought the training was helpful or valuable, particularly the discussion questions. The majority said they intended to use the skills on the jobsite. With the exception of the role-play activities, the trainers rated highly all other components, especially the videos and discussion questions. Modifications were made to the training materials and surveys based on pilot test findings. The most important result of the development and pilot testing efforts is that the OSHA Training Institute (OTI) included the FSL as an elective in the OSHA 30-h course.                  Conclusions:                       The FSL module fills a needed skills gap by providing safety leadership training to all foremen who might otherwise not have access to it through their company or union. The continued success of the FSL training will be ensured by dissemination via the OSHA 30-h course, an established nationwide safety training program. Practical applications: The FSL training module has already been widely accepted by the construction industry as a useful approach for providing construction foremen/See new abstract lead workers with the knowledge and skills they need to become more effective jobsite safety leaders."
46,"Safety, incentives, and the reporting of work-related injuries among union carpenters: ""you're pretty much screwed if you get hurt at work""",American journal of industrial medicine,"Background:                       In the high-risk construction industry little is known about the prevalence or effects of programs offering rewards for workers and/or their supervisors for improved safety records or those that punish workers in some way for injury.                  Methods:                       We conducted an anonymous survey of 1,020 carpenter apprentices in three union training programs to document prevalence of their exposure to such efforts. We explored associations between perceptions of the reporting of work-related injury and elements of these programs.                  Results:                       Fifty-eight percent (58%; n = 592) reported some safety incentive or negative consequence of work-related injuries on their current jobsite. Reporting of work-related injuries was 50% less prevalent when workers were disciplined for injury experiences. Otherwise, we saw minimal evidence of association between injury reporting practices and safety incentive programs. However, considerable evidence of fear of reprisal for reporting injuries was revealed. Less than half (46.4%) reported that work-related injuries were reported in their current workplace all or most of the time; over 30% said they were almost never or rarely reported.                  Conclusions:                       There are multiple layers of disincentives to the reporting of work-related injuries that hamper understanding of risk and pose threats to workplace safety and productivity. These pressures do not arise in a vacuum and are likely influenced by a host of contextual factors. Efforts that help us understand variation across jobsites and time could be enlightening; such inquiries may require mixed methodologies and should be framed with consideration for the upper tiers of the public health hierarchy of hazard control."
47,How do organizational practices relate to perceived system safety effectiveness? Perceptions of safety climate and co-worker commitment to safety as workplace safety signals,Journal of safety research,"Introduction:                       Integrating safety climate research with signaling theory, we propose that individual perceptions of safety climate signal the importance of safety in the organization. Specifically, we expect that three work-related organizational practices (training effectiveness, procedure effectiveness, and work pressure) relate to the broader risk control system in the workplace via individual perceptions of safety climate as a broad management signal. Further, we expect this broad management signal interacts with a local environmental signal (co-worker commitment to safety) to amplify or diminish perceived system safety effectiveness.                  Method:                       In a field study of oil and gas workers (N = 219; Study 1), we used mediation modeling to determine the relationships between work-related organizational practices, perceived safety climate, and perceived safety system effectiveness. In a field study of railway construction workers (N = 131; Study 2), we used moderated mediation modeling to explore the conditional role of co-worker commitment to safety.                  Results:                       We found that training effectiveness, procedure effectiveness, and work pressure predicted perceived system safety effectiveness indirectly via perceived safety climate (Studies 1 and 2) and that these indirect paths are influenced by co-worker commitment to safety (Study 2).                  Conclusions:                       Findings suggest that perceived safety climate is driven in part by work practices, and that perceived safety climate (from managers) and co-worker commitment to safety (from the local environment) interact to shape workplace safety system effectiveness. Practical applications: The insight that training, procedures, and work pressure are meaningful predictors of perceived safety climate as a signal suggests that organizations should be cognizant of the quality of work-related practices for safety. The insight we offer on the competing versus complimentary nature of managerial safety signals (perceived safety climate) and co-worker safety signals (co-worker commitment to safety) could also be used by safety personnel to develop safety interventions directed in both areas."
48,Evaluating effectiveness of an integrated return-to-work and vocational rehabilitation program on work disability duration in the construction sector,"Scandinavian journal of work, environment & health","Objective:                       The aim of this study was to investigate whether an integrated return-to-work (RTW) and vocational rehabilitation (VR) program - the Work Reintegration (WR) program - was associated with reduced work disability duration in the construction sector in Ontario, Canada.                  Methods:                       Workers' compensation data from the Ontario Workplace Safety and Insurance Board were extracted for lost-time construction worker claims following work-related injuries between 2009 and 2015. Claims receiving referrals to RTW and VR specialists (treatments) were matched with claims receiving no referrals (controls) during the periods before and after the WR program introduction. Multivariable difference-in-differences linear and quantile regression models were used to examine differences in cumulative disability days paid during two-years post-injury between treatment and control groups before and after the program change and the difference in these differences, overall, and at different disability distribution percentiles.                  Results:                       The WR program introduction was associated with reductions in cumulative disability days paid for all claims but most notably among longer duration claims referred to RTW specialists (reduction of 274 days at the 90th percentile in the disability distribution) and shorter duration claims referred to VR specialists (reductions of 255 and 214 days at the 25th and 50th percentiles in the disability distribution, respectively).                  Conclusions:                       The WR program introduction was effective in reducing cumulative disability days paid for construction worker claims but the effects varied at different percentiles in the disability distribution, as well as by specialist referral. The findings highlight the benefits of better integrated RTW and VR services to injured workers in the construction sector."
49,A hybrid simulation approach for integrating safety behavior into construction planning: An earthmoving case study,Accident; analysis and prevention,"One of the key challenges in improving construction safety and health is the management of safety behavior. From a system point of view, workers work unsafely due to system level issues such as poor safety culture, excessive production pressure, inadequate allocation of resources and time and lack of training. These systemic issues should be eradicated or minimized during planning. However, there is a lack of detailed planning tools to help managers assess the impact of their upstream decisions on worker safety behavior. Even though simulation had been used in construction planning, the review conducted in this study showed that construction safety management research had not been exploiting the potential of simulation techniques. Thus, a hybrid simulation framework is proposed to facilitate integration of safety management considerations into construction activity simulation. The hybrid framework consists of discrete event simulation (DES) as the core, but heterogeneous, interactive and intelligent (able to make decisions) agents replace traditional entities and resources. In addition, some of the cognitive processes and physiological aspects of agents are captured using system dynamics (SD) approach. The combination of DES, agent-based simulation (ABS) and SD allows a more ""natural"" representation of the complex dynamics in construction activities. The proposed hybrid framework was demonstrated using a hypothetical case study. In addition, due to the lack of application of factorial experiment approach in safety management simulation, the case study demonstrated sensitivity analysis and factorial experiment to guide future research."
50,The Construction and Effect Analysis of Nursing Safety Quality Management Based on Data Mining,Computational intelligence and neuroscience,"Data mining belongs to knowledge discovery, which is the process of revealing hidden, unknown, and valuable information from a large amount of fuzzy application data. The potential information revealed by data mining can help decision-makers adjust market strategies and reduce market risks. The information mined can be the discovery of a particular study and little known, which must be based on the principle of truth. Nursing safety means that during nursing work, the nursing staff must strictly follow the nursing system and operating procedures, accurately execute doctor's orders, implement nursing plans, and ensure that patients get physical and mental safety during treatment and recovery. This paper aims to explore the construction of nursing safety quality management system and its effect analysis based on data mining. It is hoped that improvements in hospital nursing processes will provide better nursing services for patients using data mining techniques. This paper uses the FP algorithm to mine the data set and generates frequent itemsets, proposes and implements the association rule mining algorithm, and obtains the association rules with practical reference value. This article analyzes the current status and existing problems of nursing management, and puts forward some problems existing in the current nursing management staff's own quality, nursing quality system standards, and nursing management system. The experimental results in this article show that there are 42 cases of poor nursing due to lack of basic medical knowledge, accounting for 52%; there are 12 cases of poor nursing due to their own diseases, accounting for 15%; there were 7 cases of poor nursing due to lack of communication, accounting for 9%; there were 15 cases of poor nursing caused by unreasonable use of restraint devices, accounting for 19%. From these data, it can be seen that patients need to have basic medical knowledge and act in strict accordance with doctors' orders. Family members also need to accompany the patients more and cooperate with all parties in order to maximize the effectiveness of care."
